{
  "schema_version": "1",
  "sent_at": "2026-09-23T10:00:12.500000Z",
  "sdk": {
    "name": "sunkcost-python",
    "version": "0.1.0"
  },
  "dropped_events": 0,
  "events": [
    {
      "type": "step",
      "run_id": "01a0cdb5-3500-7a3c-9e41-5b2f8c7d6e10",
      "seq": 2,
      "ts": "2026-09-23T10:00:01.450000Z",
      "kind": "tool",
      "model": null,
      "tool_name": "search_kb",
      "args_hash": "hmac-sha256:3b4c1e0f9a2d7c65e8f1b0a9d4c3e2f1a0b9c8d7e6f5a4b3c2d1e0f9a8b7c6d5",
      "input_tokens": 0,
      "output_tokens": 0,
      "cost_usd": "0.002000",
      "error": false,
      "latency_ms": 310,
      "decision": {
        "action": "CONTINUE",
        "score": "0.1102",
        "threshold": "0.842106",
        "would_abort": false,
        "reason": "below_min_steps"
      }
    },
    {
      "type": "run_end",
      "run_id": "01a0cdb5-3500-7a3c-9e41-5b2f8c7d6e10",
      "ended_at": "2026-09-23T10:00:11.800000Z",
      "status": "completed",
      "total_cost_usd": "0.184000",
      "steps": 11,
      "would_abort_step": 3,
      "cost_through_would_abort_usd": "0.014006",
      "aborted_step": null
    }
  ]
}
