{
  "schema_version": "1",
  "sent_at": "2026-09-23T10:00:12.500000Z",
  "sdk": {
    "name": "sunkcost-python",
    "version": "0.1.0"
  },
  "dropped_events": 0,
  "events": [
    {
      "type": "run_start",
      "run_id": "01a0cdb5-3cd0-74de-a513-7d4fae9b8c32",
      "workload": "support.billing_dispute",
      "external_ref": "CI-4411",
      "started_at": "2026-09-23T10:00:00.000000Z",
      "bundle_id": "01a03336-78b8-7c55-b624-8e5a0fac9d43",
      "bundle_version": 7,
      "mode": "enforce",
      "holdout": false
    },
    {
      "type": "step",
      "run_id": "01a0cdb5-3cd0-74de-a513-7d4fae9b8c32",
      "seq": 1,
      "ts": "2026-09-23T10:00:04.000000Z",
      "kind": "model",
      "model": "claude-sonnet-4-5",
      "tool_name": null,
      "args_hash": null,
      "input_tokens": 900,
      "output_tokens": 50,
      "cost_usd": "0.003450",
      "error": false,
      "latency_ms": 310,
      "decision": {
        "action": "CONTINUE",
        "score": "0.12",
        "threshold": "0.842106",
        "would_abort": false,
        "reason": "below_min_steps"
      }
    },
    {
      "type": "step",
      "run_id": "01a0cdb5-3cd0-74de-a513-7d4fae9b8c32",
      "seq": 2,
      "ts": "2026-09-23T10:00:05.000000Z",
      "kind": "tool",
      "model": null,
      "tool_name": "run_tests",
      "args_hash": "hmac-sha256:7e2a9c4b1d0f8e3a6c5b4d9e2f1a0c8b7d6e5f4a3b2c1d0e9f8a7b6c5d4e3f2a",
      "input_tokens": 0,
      "output_tokens": 0,
      "cost_usd": "0",
      "error": true,
      "latency_ms": 310,
      "decision": {
        "action": "CONTINUE",
        "score": "0.31",
        "threshold": "0.842106",
        "would_abort": false,
        "reason": "below_min_steps"
      }
    },
    {
      "type": "step",
      "run_id": "01a0cdb5-3cd0-74de-a513-7d4fae9b8c32",
      "seq": 3,
      "ts": "2026-09-23T10:00:06.000000Z",
      "kind": "tool",
      "model": null,
      "tool_name": "run_tests",
      "args_hash": "hmac-sha256:7e2a9c4b1d0f8e3a6c5b4d9e2f1a0c8b7d6e5f4a3b2c1d0e9f8a7b6c5d4e3f2a",
      "input_tokens": 0,
      "output_tokens": 0,
      "cost_usd": "0",
      "error": true,
      "latency_ms": 310,
      "decision": {
        "action": "CONTINUE",
        "score": "0.64",
        "threshold": "0.842106",
        "would_abort": false,
        "reason": "below_min_steps"
      }
    },
    {
      "type": "run_end",
      "run_id": "01a0cdb5-3cd0-74de-a513-7d4fae9b8c32",
      "ended_at": "2026-09-23T10:00:06.100000Z",
      "status": "aborted",
      "total_cost_usd": "0.003450",
      "steps": 3,
      "would_abort_step": 3,
      "cost_through_would_abort_usd": "0.003450",
      "aborted_step": 3
    }
  ]
}
